Pack Name,Target User,Problem Solved,Product Categories,Exclusions,Estimated Cost,Donation Fit,Fulfillment Complexity,Local Pickup Fit,Safety Notes,MVP Priority
"Starter Diabetic Care Pack","newly diagnosed or overwhelmed adult","baseline organization and daily readiness","pill organizer category, supply bin, glucose log notebook, emergency sheet folder, reminder setup guide, low-carb snack category","prescription meds, treatment supplies needing clinician instruction","$35-$75","High","Low","High","Education and organization only; consult clinician","P0"
"Foot Protection Pack","foot-risk adults/seniors","daily foot awareness and basic protection","mirror, soft socks, non-medical foot checklist, shoe-fit checklist, flashlight, appointment note pad","wound treatment products, medicated creams, sharp tools","$25-$80","Very high","Low","High","No wound treatment; clinician/podiatrist directs care","P0"
"Post-Hospital Recovery Pack","recent discharge","first 30 days logistics","document folder, appointment calendar, medication-list template, caregiver call sheet, transport checklist, meal support directory","clinical instructions or dosing advice","$30-$90","Very high","Medium","High","Follow discharge plan; call clinician for medical questions","P0"
"Wound-Care Organization Pack","person under wound-care supervision","organize clinician-directed wound records","waterproof folder, photo log template, appointment tracker, supply inventory sheet, clean storage bin","wound treatment protocols, dressings unless clinician-specified","$25-$70","High","Medium","High","Clinician direction required for all wound care","P1"
"Travel Diabetes Pack","traveling person with diabetes","reduce travel disruption","travel checklist, document sleeve, snack category, backup battery category, emergency contact card","prescription backups supplied by LocalDiabetic","$25-$75","Medium","Low","High","Travel planning only; user handles prescriptions","P2"
"Senior Support Pack","senior with diabetes","routine + safety coordination","large-print checklist, emergency sheet, family contact card, supply bin labels, phone reminder guide","medical devices requiring prescription","$35-$95","High","Medium","High","Organization only; caregiver consent needed","P1"
"Family/Caregiver Pack","family caregiver","shared visibility without overreach","permission worksheet, emergency sheet, update template, fridge checklist, appointment prep form","monitoring without consent","$20-$60","High","Low","High","Respect user control and revocation","P0"
"Low-Income Emergency Supply Pack","low-income person with diabetes","non-prescription support gap","hygiene items, socks, food resource card, transport resource card, storage pouch","prescription meds, insulin, regulated devices","$30-$100","Very high","Medium","High","No substitution for medical supplies or prescriptions","P1"
"Apple Watch Reminder Starter Pack","iPhone/Watch user","reminder setup","setup guide, checklist templates, charger category, watch band comfort note","medical alarm claims","$0-$40","Medium","Low","Digital","Reminders only, not clinical alerting unless user-configured device supports it","P1"
"NAS Vault Starter Pack","privacy-focused family","local records organization","Synology guide, folder templates, emergency sheet template, backup checklist","managed PHI hosting by LocalDiabetic","$150-$700","Medium","High","Pickup/setup","Local storage risk and backup responsibility must be explained","P2"
"Mobility / Recovery Pack","limited mobility","home movement logistics","non-slip socks category, reacher category, transport list, home setup checklist","therapy advice, mobility device fitting","$40-$140","Medium","Medium","High","Licensed professional for mobility/therapy decisions","P2"
"Food Stability Pack","food-insecure person","food planning and resource connection","food bank directory, shelf-stable healthy category, meal planning worksheet, grocery list template","diet prescription or medical nutrition therapy","$35-$120","Very high","Medium","High","Nutrition advice must be general or clinician/dietitian-directed","P1"
